run_id	commit	candidate_id	status	selection_score	pricing_status	segmentation_status	capped_pp_gini_mean	capped_pp_calibration_gap_mean	capped_pp_mae_mean	raw_pp_gini_mean	raw_pp_calibration_gap_mean	runtime_seconds	gate_failures	description
20260428_145353_1fc5443_lightgbm_191_mid	1fc5443	lightgbm_191_mid	keep	0.18737500	candidate	not_segmentation	0.18950000	-0.00850000	218.23400000	0.21260000	-0.06540000	25.10		0.191 mid: feature 0.52 / bagging 0.52 + 16/24. Slightly higher than 0.515.
20260428_145440_1fc5443_lightgbm_191_17_leaves	1fc5443	lightgbm_191_17_leaves	keep	0.17962500	candidate	not_segmentation	0.18490000	-0.02110000	216.90660000	0.21440000	-0.06700000	26.14		0.191-17: feature 0.515 / bagging 0.515 + 17/25. More leaves.
20260428_145526_1fc5443_lightgbm_191_lower_min	1fc5443	lightgbm_191_lower_min	discard	0.18145000	not_pricing	not_segmentation	0.18590000	-0.01780000	217.28140000	0.20700000	-0.06750000	25.60	pricing_raw_gini_not_materially_worse;segmentation_minimum_capped_gini_gain;segmentation_minimum_fold_agreement;segmentation_raw_gini_not_materially_worse	0.191 lower: feature 0.515 + lower min_data (1750/1450). More flexibility.
20260428_145612_1fc5443_lightgbm_191_slide	1fc5443	lightgbm_191_slide	keep	0.18495000	candidate	not_segmentation	0.18800000	-0.01220000	217.81960000	0.21520000	-0.06580000	25.69		0.191 slide: feature 0.514 + 16/24 + L2 12.8/10.8. Lower L2.
20260428_145706_1fc5443_lightgbm_191_higher_lr	1fc5443	lightgbm_191_higher_lr	discard	0.18812500	not_pricing	not_segmentation	0.19050000	-0.00950000	218.11750000	0.20720000	-0.06980000	24.75	pricing_raw_gini_not_materially_worse;segmentation_minimum_capped_gini_gain;segmentation_minimum_fold_agreement;segmentation_raw_gini_not_materially_worse	0.191 higher: feature 0.515 + LR 0.038/0.033. Higher learning rate.
20260428_145807_1fc5443_lightgbm_191_compact	1fc5443	lightgbm_191_compact	discard	0.18527500	not_pricing	not_segmentation	0.18840000	-0.01250000	217.77340000	0.21320000	-0.06560000	25.29	pricing_material_improvement;segmentation_minimum_capped_gini_gain;segmentation_minimum_fold_agreement	0.191 compact: feature 0.516 + 16/24 + L2 14.0/12.0. Slightly higher randomization + L2.
20260428_145906_1fc5443_lightgbm_191_exact_v2	1fc5443	lightgbm_191_exact_v2	keep	0.18847500	candidate	not_segmentation	0.19090000	-0.00970000	218.10740000	0.21400000	-0.06580000	25.24		0.191 exact v2: feature 0.515 + 16/24 + L2 13.4/11.4 + 175 rounds. Exact best config with more iterations.
20260428_145952_1fc5443_lightgbm_191_exact_v3	1fc5443	lightgbm_191_exact_v3	discard	0.18832500	not_pricing	not_segmentation	0.19070000	-0.00950000	218.12640000	0.20780000	-0.06950000	25.67	pricing_material_improvement;pricing_raw_gini_not_materially_worse;segmentation_minimum_capped_gini_gain;segmentation_raw_gini_not_materially_worse	0.191 exact v3: feature 0.515 + 16/24 + L2 13.2/11.2. Slight L2 reduction.
20260428_150059_1fc5443_lightgbm_191_exact_v4	1fc5443	lightgbm_191_exact_v4	discard	0.18862500	not_pricing	not_segmentation	0.19100000	-0.00950000	218.12770000	0.21430000	-0.06560000	25.23	pricing_material_improvement;segmentation_minimum_capped_gini_gain	0.191 exact v4: feature 0.515 + 16/24 + L2 13.5/11.5. Slight L2 increase.
20260428_150224_1fc5443_lightgbm_191_try	1fc5443	lightgbm_191_try	discard	0.18850000	not_pricing	not_segmentation	0.19090000	-0.00960000	218.11520000	0.21360000	-0.06570000	25.94	pricing_material_improvement;segmentation_minimum_capped_gini_gain	0.191 try: feature 0.515 + 16/24 + L2 13.6/11.6. L2 increase again.
20260428_150316_1fc5443_lightgbm_191_sweeter	1fc5443	lightgbm_191_sweeter	discard	0.18590000	not_pricing	not_segmentation	0.18890000	-0.01200000	217.83970000	0.21460000	-0.06540000	25.34	pricing_material_improvement;segmentation_minimum_capped_gini_gain;segmentation_minimum_fold_agreement	0.191 sweeter: feature 0.514 + 16/24 + L2 13.5. Lower fraction.
20260428_160916_1dbe3a3_lightgbm_0001_autotune	1dbe3a3	lightgbm_0001_autotune	discard	0.18827500	not_pricing	not_segmentation	0.19060000	-0.00930000	218.16640000	0.20710000	-0.06740000	25.69	pricing_material_improvement;pricing_raw_gini_not_materially_worse;segmentation_minimum_capped_gini_gain;segmentation_minimum_fold_agreement;segmentation_raw_gini_not_materially_worse	Auto-generated: lr variation on champion. FF=0.515, L2=13.4, leaves=16/24
20260428_160943_9760cd8_lightgbm_0002_autotune	9760cd8	lightgbm_0002_autotune	discard	0.18765000	not_pricing	not_segmentation	0.19010000	-0.00980000	218.08710000	0.21330000	-0.06580000	27.30	pricing_material_improvement;segmentation_minimum_capped_gini_gain	Auto-generated: min_data variation on champion. FF=0.515, L2=13.4, leaves=16/24
20260428_161018_381886c_lightgbm_0002_autotune	381886c	lightgbm_0002_autotune	discard	0.18765000	not_pricing	not_segmentation	0.19010000	-0.00980000	218.08710000	0.21330000	-0.06580000	26.21	pricing_material_improvement;segmentation_minimum_capped_gini_gain	Auto-generated: min_data variation on champion. FF=0.515, L2=13.4, leaves=16/24
20260428_161055_381886c_lightgbm_0002_autotune	381886c	lightgbm_0002_autotune	discard	0.18765000	not_pricing	not_segmentation	0.19010000	-0.00980000	218.08710000	0.21330000	-0.06580000	25.11	pricing_material_improvement;segmentation_minimum_capped_gini_gain	Auto-generated: min_data variation on champion. FF=0.515, L2=13.4, leaves=16/24
20260428_161150_381886c_lightgbm_0001_autotune	381886c	lightgbm_0001_autotune	discard	0.18892500	not_pricing	not_segmentation	0.19110000	-0.00870000	218.19860000	0.20770000	-0.06870000	27.74	pricing_raw_gini_not_materially_worse;segmentation_minimum_capped_gini_gain;segmentation_raw_gini_not_materially_worse	Auto-generated: lr variation on champion. FF=0.515, L2=13.4, leaves=16/24
20260428_161230_bb60ff9_lightgbm_0001_autotune	bb60ff9	lightgbm_0001_autotune	discard	0.18892500	not_pricing	not_segmentation	0.19110000	-0.00870000	218.19860000	0.20770000	-0.06870000	26.33	pricing_raw_gini_not_materially_worse;segmentation_minimum_capped_gini_gain;segmentation_raw_gini_not_materially_worse	Auto-generated: lr variation on champion. FF=0.515, L2=13.4, leaves=16/24
20260428_161318_bb60ff9_lightgbm_0001_autotune	bb60ff9	lightgbm_0001_autotune	discard	0.18837500	not_pricing	not_segmentation	0.19080000	-0.00970000	218.10890000	0.21280000	-0.06570000	26.04	pricing_material_improvement;segmentation_minimum_capped_gini_gain;segmentation_minimum_fold_agreement	Auto-generated: min_data variation on champion. FF=0.515, L2=13.4, leaves=16/24
20260428_161408_a3e448d_lightgbm_0001_autotune	a3e448d	lightgbm_0001_autotune	discard	0.18872500	not_pricing	not_segmentation	0.19040000	-0.00670000	218.39740000	0.20650000	-0.06930000	25.84	pricing_raw_gini_not_materially_worse;segmentation_minimum_capped_gini_gain;segmentation_minimum_fold_agreement;segmentation_raw_gini_not_materially_worse	Auto-generated: lr variation on champion. FF=0.515, L2=13.4, leaves=16/24
20260428_161523_431f77a_lightgbm_0001_autotune	431f77a	lightgbm_0001_autotune	discard	0.18517500	not_pricing	not_segmentation	0.18830000	-0.01250000	217.81200000	0.20790000	-0.06540000	26.03	pricing_material_improvement;pricing_raw_gini_not_materially_worse;segmentation_minimum_capped_gini_gain;segmentation_minimum_fold_agreement;segmentation_raw_gini_not_materially_worse	Auto-generated: lr variation on champion. FF=0.515, L2=13.4, leaves=16/24
20260428_161558_07f8179_lightgbm_0001_autotune	07f8179	lightgbm_0001_autotune	discard	0.18740000	not_pricing	not_segmentation	0.18980000	-0.00960000	218.10950000	0.21300000	-0.06560000	26.81	pricing_material_improvement;segmentation_minimum_capped_gini_gain	Auto-generated: leaves variation on champion. FF=0.515, L2=13.4, leaves=18/26
20260428_161626_57620f2_lightgbm_0002_autotune	57620f2	lightgbm_0002_autotune	discard	0.18402500	not_pricing	not_segmentation	0.18720000	-0.01270000	217.77380000	0.21240000	-0.06530000	30.02	pricing_material_improvement;segmentation_minimum_capped_gini_gain;segmentation_minimum_fold_agreement	Auto-generated: fraction variation on champion. FF=0.520, L2=13.4, leaves=16/24
20260428_161656_7878ec5_lightgbm_0003_autotune	7878ec5	lightgbm_0003_autotune	discard	0.18792500	not_pricing	not_segmentation	0.19040000	-0.00990000	218.08010000	0.20610000	-0.07060000	29.81	pricing_material_improvement;pricing_raw_gini_not_materially_worse;segmentation_minimum_capped_gini_gain;segmentation_raw_gini_not_materially_worse	Auto-generated: lr variation on champion. FF=0.515, L2=13.4, leaves=16/24
20260428_161726_e74b709_lightgbm_0004_autotune	e74b709	lightgbm_0004_autotune	discard	0.18837500	not_pricing	not_segmentation	0.19080000	-0.00970000	218.10890000	0.21280000	-0.06570000	28.18	pricing_material_improvement;segmentation_minimum_capped_gini_gain;segmentation_minimum_fold_agreement	Auto-generated: min_data variation on champion. FF=0.515, L2=13.4, leaves=16/24
20260428_161755_2cfb961_lightgbm_0005_autotune	2cfb961	lightgbm_0005_autotune	discard	0.18837500	not_pricing	not_segmentation	0.19080000	-0.00970000	218.10890000	0.21280000	-0.06570000	28.13	pricing_material_improvement;segmentation_minimum_capped_gini_gain;segmentation_minimum_fold_agreement	Auto-generated: min_data variation on champion. FF=0.515, L2=13.4, leaves=16/24
20260428_165312_5d1b685_lightgbm_ft_0001	5d1b685	lightgbm_ft_0001	discard	0.17835000	not_pricing	not_segmentation	0.18440000	-0.02420000	216.57620000	0.21530000	-0.06430000	24.46	pricing_capped_gini_not_materially_worse;segmentation_minimum_capped_gini_gain;segmentation_minimum_fold_agreement	Fine-tune: lr. FF=0.515, L2=13.4
20260428_165337_996aae5_lightgbm_ft_0002	996aae5	lightgbm_ft_0002	discard	0.18870000	not_pricing	not_segmentation	0.19050000	-0.00720000	218.36120000	0.20640000	-0.06790000	28.34	pricing_raw_gini_not_materially_worse;segmentation_minimum_capped_gini_gain;segmentation_raw_gini_not_materially_worse	Fine-tune: l2. FF=0.515, L2=13.3
20260428_165406_0c9bd15_lightgbm_ft_0003	0c9bd15	lightgbm_ft_0003	discard	0.18880000	not_pricing	not_segmentation	0.19060000	-0.00720000	218.36040000	0.20900000	-0.06810000	27.60	pricing_raw_gini_not_materially_worse;segmentation_minimum_capped_gini_gain;segmentation_raw_gini_not_materially_worse	Fine-tune: lr. FF=0.515, L2=13.4
20260428_165434_5c2e435_lightgbm_ft_0004	5c2e435	lightgbm_ft_0004	discard	0.17875000	not_pricing	not_segmentation	0.18410000	-0.02140000	216.86670000	0.21210000	-0.06820000	28.05	pricing_capped_gini_not_materially_worse;segmentation_minimum_capped_gini_gain;segmentation_minimum_fold_agreement	Fine-tune: combo. FF=0.518, L2=13.5
20260428_165502_5ea80a1_lightgbm_ft_0005	5ea80a1	lightgbm_ft_0005	discard	0.18930000	not_pricing	not_segmentation	0.19110000	-0.00720000	218.36580000	0.20630000	-0.06790000	27.74	pricing_raw_gini_not_materially_worse;segmentation_minimum_capped_gini_gain;segmentation_raw_gini_not_materially_worse	Fine-tune: min_data. FF=0.515, L2=13.4
20260428_165530_81acb5a_lightgbm_ft_0006	81acb5a	lightgbm_ft_0006	discard	0.18870000	not_pricing	not_segmentation	0.19050000	-0.00720000	218.35980000	0.20640000	-0.06790000	27.75	pricing_raw_gini_not_materially_worse;segmentation_minimum_capped_gini_gain;segmentation_raw_gini_not_materially_worse	Fine-tune: l2. FF=0.515, L2=13.3
20260428_165559_0973108_lightgbm_ft_0007	0973108	lightgbm_ft_0007	discard	0.18915000	not_pricing	not_segmentation	0.19090000	-0.00700000	218.37430000	0.20650000	-0.06760000	28.04	pricing_raw_gini_not_materially_worse;segmentation_minimum_capped_gini_gain;segmentation_raw_gini_not_materially_worse	Fine-tune: leaves. FF=0.515, L2=13.4
20260428_165627_4a7d46c_lightgbm_ft_0008	4a7d46c	lightgbm_ft_0008	discard	0.18930000	not_pricing	not_segmentation	0.19110000	-0.00720000	218.36390000	0.20720000	-0.06780000	28.25	pricing_raw_gini_not_materially_worse;segmentation_minimum_capped_gini_gain;segmentation_raw_gini_not_materially_worse	Fine-tune: l2. FF=0.515, L2=13.5
20260428_165656_e9b5218_lightgbm_ex_0009	e9b5218	lightgbm_ex_0009	discard	0.18442500	not_pricing	not_segmentation	0.18760000	-0.01270000	217.77700000	0.21210000	-0.06630000	27.81	pricing_material_improvement;segmentation_minimum_capped_gini_gain;segmentation_minimum_fold_agreement	Explore: different_lr. FF=0.520, L2=13.3, leaves=15
20260428_165724_7f30fe5_lightgbm_ex_0010	7f30fe5	lightgbm_ex_0010	discard	0.18530000	not_pricing	not_segmentation	0.18790000	-0.01040000	217.97570000	0.21350000	-0.06900000	29.48	pricing_material_improvement;segmentation_minimum_capped_gini_gain;segmentation_minimum_fold_agreement	Explore: higher_ff. FF=0.538, L2=10.8, leaves=20
20260428_165754_5e1dc80_lightgbm_ex_0011	5e1dc80	lightgbm_ex_0011	discard	0.17982500	not_pricing	not_segmentation	0.18420000	-0.01750000	217.29540000	0.21010000	-0.07200000	26.76	pricing_capped_gini_not_materially_worse;segmentation_minimum_capped_gini_gain;segmentation_minimum_fold_agreement	Explore: fewer_leaves. FF=0.509, L2=14.1, leaves=12
20260428_165822_b7c8f47_lightgbm_ex_0012	b7c8f47	lightgbm_ex_0012	discard	0.17940000	not_pricing	not_segmentation	0.18420000	-0.01920000	217.10630000	0.20440000	-0.06790000	28.01	pricing_capped_gini_not_materially_worse;pricing_raw_gini_not_materially_worse;segmentation_minimum_capped_gini_gain;segmentation_minimum_fold_agreement;segmentation_raw_gini_not_materially_worse	Explore: different_lr. FF=0.511, L2=12.5, leaves=15
20260428_165850_f50b617_lightgbm_ex_0013	f50b617	lightgbm_ex_0013	discard	0.17947500	not_pricing	not_segmentation	0.18460000	-0.02050000	216.97560000	0.21530000	-0.06480000	27.92	pricing_capped_gini_not_materially_worse;segmentation_minimum_capped_gini_gain;segmentation_minimum_fold_agreement	Explore: different_l2. FF=0.502, L2=9.7, leaves=16
20260428_165918_3c313c9_lightgbm_ex_0014	3c313c9	lightgbm_ex_0014	keep	0.18215000	candidate	not_segmentation	0.18690000	-0.01900000	217.09870000	0.21080000	-0.07250000	28.94		Explore: balanced. FF=0.517, L2=11.4, leaves=18
20260428_165948_80d5bf6_lightgbm_ex_0015	80d5bf6	lightgbm_ex_0015	discard	0.17655000	not_pricing	not_segmentation	0.18230000	-0.02300000	216.70920000	0.21620000	-0.06470000	27.75	pricing_material_improvement;segmentation_minimum_capped_gini_gain;segmentation_minimum_fold_agreement	Explore: fewer_leaves. FF=0.502, L2=12.5, leaves=12
20260428_170016_7dc36fc_lightgbm_ex_0016	7dc36fc	lightgbm_ex_0016	keep	0.18442500	candidate	not_segmentation	0.18750000	-0.01230000	217.89020000	0.20970000	-0.08290000	29.20		Explore: very_low_ff. FF=0.469, L2=13.6, leaves=16
20260428_170046_adf01b5_lightgbm_ex_0017	adf01b5	lightgbm_ex_0017	keep	0.18170000	candidate	not_segmentation	0.18660000	-0.01960000	217.06710000	0.21680000	-0.06830000	28.65		Explore: balanced. FF=0.512, L2=13.5, leaves=17
20260428_170115_c9a6ab8_lightgbm_ex_0018	c9a6ab8	lightgbm_ex_0018	discard	0.18610000	not_pricing	not_segmentation	0.18920000	-0.01240000	217.78650000	0.21180000	-0.06840000	29.54	pricing_raw_gini_not_materially_worse;segmentation_minimum_capped_gini_gain;segmentation_minimum_fold_agreement	Explore: more_leaves. FF=0.519, L2=12.4, leaves=24
20260428_170145_0c566f6_lightgbm_ex_0019	0c566f6	lightgbm_ex_0019	discard	0.18070000	not_pricing	not_segmentation	0.18580000	-0.02040000	216.97840000	0.20520000	-0.07750000	28.25	pricing_material_improvement;pricing_raw_gini_not_materially_worse;segmentation_minimum_capped_gini_gain;segmentation_minimum_fold_agreement;segmentation_raw_gini_not_materially_worse	Explore: higher_ff. FF=0.527, L2=11.4, leaves=16
20260428_170214_363e28a_lightgbm_ex_0020	363e28a	lightgbm_ex_0020	discard	0.18750000	not_pricing	not_segmentation	0.18880000	-0.00520000	218.67080000	0.21100000	-0.07000000	29.38	pricing_raw_gini_not_materially_worse;segmentation_minimum_capped_gini_gain;segmentation_minimum_fold_agreement	Explore: very_low_ff. FF=0.457, L2=14.4, leaves=17
20260428_170331_c26e051_lightgbm_ft_0001	c26e051	lightgbm_ft_0001	discard	0.18162500	not_pricing	not_segmentation	0.18640000	-0.01910000	217.10560000	0.21500000	-0.06460000	26.18	pricing_material_improvement;segmentation_minimum_capped_gini_gain;segmentation_minimum_fold_agreement	Fine-tune: combo. FF=0.510, L2=13.7
20260428_170358_76a5734_lightgbm_ft_0002	76a5734	lightgbm_ft_0002	discard	0.17997500	not_pricing	not_segmentation	0.18500000	-0.02010000	217.00480000	0.21480000	-0.06500000	28.35	pricing_material_improvement;segmentation_minimum_capped_gini_gain;segmentation_minimum_fold_agreement	Fine-tune: l2. FF=0.512, L2=13.1
20260428_170427_91b37cb_lightgbm_ft_0003	91b37cb	lightgbm_ft_0003	discard	0.17850000	not_pricing	not_segmentation	0.18350000	-0.02000000	217.03020000	0.21090000	-0.07130000	27.88	pricing_material_improvement;pricing_raw_gini_not_materially_worse;segmentation_minimum_capped_gini_gain;segmentation_minimum_fold_agreement	Fine-tune: leaves. FF=0.512, L2=13.5
20260428_170455_a6abd83_lightgbm_ft_0004	a6abd83	lightgbm_ft_0004	keep	0.17995000	candidate	not_segmentation	0.18640000	-0.02580000	216.40160000	0.21620000	-0.06240000	27.81		Fine-tune: lr. FF=0.512, L2=13.5
20260428_170523_1dcc1ec_lightgbm_ft_0005	1dcc1ec	lightgbm_ft_0005	keep	0.18045000	candidate	not_segmentation	0.18600000	-0.02220000	216.77970000	0.21530000	-0.06470000	28.71		Fine-tune: combo. FF=0.510, L2=13.7
20260428_170553_e36b48c_lightgbm_ft_0006	e36b48c	lightgbm_ft_0006	keep	0.18175000	candidate	not_segmentation	0.18610000	-0.01740000	217.31400000	0.21490000	-0.06490000	28.78		Fine-tune: combo. FF=0.515, L2=13.5
20260428_170622_1d4902b_lightgbm_ft_0007	1d4902b	lightgbm_ft_0007	discard	0.18217500	not_pricing	not_segmentation	0.18650000	-0.01730000	217.29320000	0.21470000	-0.06450000	28.51	pricing_material_improvement;segmentation_minimum_capped_gini_gain;segmentation_minimum_fold_agreement	Fine-tune: combo. FF=0.510, L2=13.6
20260428_170651_0ce021c_lightgbm_ft_0008	0ce021c	lightgbm_ft_0008	keep	0.17940000	candidate	not_segmentation	0.18490000	-0.02200000	216.80780000	0.21670000	-0.06510000	27.96		Fine-tune: combo. FF=0.513, L2=13.2
20260428_170719_3aaf7af_lightgbm_ex_0009	3aaf7af	lightgbm_ex_0009	keep	0.18117500	candidate	not_segmentation	0.18600000	-0.01930000	217.07520000	0.21430000	-0.06840000	28.45		Explore: different_l2. FF=0.506, L2=9.1, leaves=16
20260428_170748_d7db94b_lightgbm_ex_0010	d7db94b	lightgbm_ex_0010	discard	0.18032500	not_pricing	not_segmentation	0.18540000	-0.02030000	216.98830000	0.21350000	-0.06780000	28.35	pricing_material_improvement;segmentation_minimum_capped_gini_gain;segmentation_minimum_fold_agreement	Explore: different_lr. FF=0.512, L2=12.9, leaves=16
20260428_170923_dfb3710_lightgbm_ex_0011	dfb3710	lightgbm_ex_0011	keep	0.17925000	candidate	not_segmentation	0.18540000	-0.02460000	216.54640000	0.21280000	-0.06610000	25.48		Explore: balanced. FF=0.518, L2=13.2, leaves=16
20260428_171006_dfb3710_lightgbm_ps_0001	dfb3710	lightgbm_ps_0001	discard	0.17745000	not_pricing	not_segmentation	0.18300000	-0.02220000	216.79180000	0.20560000	-0.06730000	26.60	pricing_raw_gini_not_materially_worse;segmentation_minimum_capped_gini_gain;segmentation_minimum_fold_agreement;segmentation_raw_gini_not_materially_worse	Paradigm: conservative
20260428_171044_dfb3710_lightgbm_ft_0001	dfb3710	lightgbm_ft_0001	keep	0.17877500	candidate	not_segmentation	0.18410000	-0.02130000	216.87250000	0.21300000	-0.07090000	26.08		Fine-tune: leaves. FF=0.518, L2=13.2
20260428_171110_dfb3710_lightgbm_ft_0001	dfb3710	lightgbm_ft_0001	discard	0.17945000	not_pricing	not_segmentation	0.18480000	-0.02140000	216.87050000	0.21450000	-0.07090000	28.97	pricing_material_improvement;segmentation_minimum_capped_gini_gain;segmentation_minimum_fold_agreement	Fine-tune: leaves. FF=0.518, L2=13.2
20260428_171151_dfb3710_lightgbm_ft_0001	dfb3710	lightgbm_ft_0001	discard	0.17865000	not_pricing	not_segmentation	0.18400000	-0.02140000	216.87440000	0.21410000	-0.07090000	26.30	pricing_material_improvement;segmentation_minimum_capped_gini_gain;segmentation_minimum_fold_agreement	Fine-tune: leaves. FF=0.518, L2=13.2
20260428_171217_80dafc0_lightgbm_ft_0002	80dafc0	lightgbm_ft_0002	keep	0.17830000	candidate	not_segmentation	0.18330000	-0.02000000	216.98140000	0.21180000	-0.07380000	28.94		Fine-tune: lr. FF=0.518, L2=13.2
20260428_171247_37b8748_lightgbm_ft_0003	37b8748	lightgbm_ft_0003	keep	0.17902500	candidate	not_segmentation	0.18440000	-0.02150000	216.85780000	0.21280000	-0.07100000	28.99		Fine-tune: min_data. FF=0.518, L2=13.2
20260428_171316_2e4406d_lightgbm_ft_0004	2e4406d	lightgbm_ft_0004	discard	0.17797500	not_pricing	not_segmentation	0.18330000	-0.02130000	216.88130000	0.21330000	-0.07090000	28.53	pricing_material_improvement;segmentation_minimum_capped_gini_gain;segmentation_minimum_fold_agreement	Fine-tune: leaves. FF=0.518, L2=13.2
20260428_171345_a9a193c_lightgbm_ft_0005	a9a193c	lightgbm_ft_0005	discard	0.18007500	not_pricing	not_segmentation	0.18520000	-0.02050000	216.97230000	0.21340000	-0.06510000	28.60	pricing_material_improvement;segmentation_minimum_capped_gini_gain;segmentation_minimum_fold_agreement	Fine-tune: ff. FF=0.518, L2=13.2
20260428_171414_bb5ea62_lightgbm_ft_0006	bb5ea62	lightgbm_ft_0006	discard	0.17372500	not_pricing	not_segmentation	0.18000000	-0.02510000	216.46030000	0.21280000	-0.06750000	29.26	pricing_material_improvement;segmentation_minimum_capped_gini_gain;segmentation_minimum_fold_agreement	Fine-tune: combo. FF=0.520, L2=13.1
20260428_171444_bb888cd_lightgbm_ft_0007	bb888cd	lightgbm_ft_0007	keep	0.17955000	candidate	not_segmentation	0.18460000	-0.02020000	217.01050000	0.21220000	-0.06400000	28.32		Fine-tune: lr. FF=0.518, L2=13.2
20260428_171513_c8bf30f_lightgbm_ft_0008	c8bf30f	lightgbm_ft_0008	keep	0.18592500	candidate	not_segmentation	0.18970000	-0.01510000	217.51340000	0.20970000	-0.06720000	28.53		Fine-tune: ff. FF=0.516, L2=13.2
