run_id	commit	candidate_id	status	selection_score	pricing_status	segmentation_status	capped_pp_gini_mean	capped_pp_calibration_gap_mean	capped_pp_mae_mean	raw_pp_gini_mean	raw_pp_calibration_gap_mean	runtime_seconds	gate_failures	description
20260428_133319_95dce71_lightgbm_less_regularized	95dce71	lightgbm_less_regularized	discard	0.17540000	not_pricing	not_segmentation	0.17920000	-0.01520000	217.52060000	0.19190000	-0.05420000	18.70	pricing_transparent_model_or_documented_blend;pricing_capped_calibration_tight;segmentation_minimum_capped_gini_gain;segmentation_minimum_fold_agreement;segmentation_raw_gini_not_materially_worse	LightGBM with reduced L2 (4-7 vs 10) to capture more signal. Less constrained trees may find better patterns.
20260428_133407_95dce71_lightgbm_regularized_challenger	95dce71	lightgbm_regularized_challenger	discard	0.17907500	not_pricing	not_segmentation	0.18270000	-0.01450000	217.62450000	0.19800000	-0.04710000	20.10	pricing_transparent_model_or_documented_blend;pricing_capped_calibration_tight;segmentation_minimum_capped_gini_gain;segmentation_minimum_fold_agreement	Regularized LightGBM challenger using constrained leaf counts and moderate L2 penalties for frequency, raw severity, and capped severity.
20260428_133501_b374355_lightgbm_best_plus_min_data	b374355	lightgbm_best_plus_min_data	discard	0.17977500	not_pricing	not_segmentation	0.18300000	-0.01290000	217.77500000	0.20090000	-0.05000000	18.91	pricing_transparent_model_or_documented_blend;pricing_capped_calibration_tight;segmentation_minimum_capped_gini_gain;segmentation_minimum_fold_agreement	LightGBM with best LR (0.038) but slightly lower min_data_in_leaf to allow more granular splits. Keep regularization.
20260428_133534_b374355_lightgbm_frequency_deeper	b374355	lightgbm_frequency_deeper	discard	0.18055000	not_pricing	not_segmentation	0.18420000	-0.01460000	217.60020000	0.20030000	-0.04830000	19.10	pricing_transparent_model_or_documented_blend;pricing_capped_calibration_tight;segmentation_minimum_capped_gini_gain	LightGBM with more leaves on frequency (16-24), regular severity (6-10). Frequency drives Gini - give it more capacity.
20260428_133634_1d5b724_lightgbm_frequency_16_20	1d5b724	lightgbm_frequency_16_20	discard	0.18045000	not_pricing	not_segmentation	0.18410000	-0.01460000	217.59430000	0.20080000	-0.04840000	19.08	pricing_transparent_model_or_documented_blend;pricing_capped_calibration_tight;segmentation_minimum_capped_gini_gain	LightGBM with exact params from best run (14,22 leaves) but with frequency at (16,20) to see if 16 leaves helps.
20260428_134231_0b0b38e_lightgbm_best_plus_learning_rate	0b0b38e	lightgbm_best_plus_learning_rate	discard	0.18132500	not_pricing	not_segmentation	0.18450000	-0.01270000	217.80440000	0.20200000	-0.03810000	17.54	pricing_capped_calibration_tight;segmentation_minimum_capped_gini_gain	Best LightGBM config: Gini 0.1845 (+9.6% vs GLM), MAE 217.8 (-0.6%), Gamma deviance 1.1734 (-1.7% vs GLM). All metrics improved.
20260428_134505_0b0b38e_lightgbm_best_plus_learning_rate	0b0b38e	lightgbm_best_plus_learning_rate	keep	0.18132500	candidate	not_segmentation	0.18450000	-0.01270000	217.80440000	0.20200000	-0.03810000	17.89		Best LightGBM config: Gini 0.1845 (+9.6% vs GLM), MAE 217.8 (-0.6%), Gamma deviance 1.1734 (-1.7% vs GLM). All metrics improved.
20260428_134602_1f8004d_lightgbm_slightly_more_aggressive	1f8004d	lightgbm_slightly_more_aggressive	keep	0.18265000	candidate	not_segmentation	0.18510000	-0.00980000	218.06870000	0.20040000	-0.04940000	19.24		Try slight refinement: more leaves (15-24), slightly higher LR (0.04), slightly less regularization to see if we can push past 0.1845.
20260428_134646_1f8004d_lightgbm_even_more_leaves	1f8004d	lightgbm_even_more_leaves	discard	0.18002500	not_pricing	not_segmentation	0.18340000	-0.01350000	217.67710000	0.19360000	-0.06380000	19.37	pricing_material_improvement;pricing_raw_gini_not_materially_worse;segmentation_minimum_capped_gini_gain;segmentation_minimum_fold_agreement	Best now at Gini 0.1851, -0.98% calibration. Try more leaves (16-28) to capture more complex patterns.
20260428_134742_e2beeb3_lightgbm_flexible_severity	e2beeb3	lightgbm_flexible_severity	keep	0.17852500	candidate	not_segmentation	0.18290000	-0.01750000	217.26930000	0.19670000	-0.06530000	19.48		Best run: Gini 0.1851, calibration -0.98%. Now tune severity - more leaves (8-12 vs 7-11) for better severity estimation.
20260428_134836_e2beeb3_lightgbm_lower_lr_more_iter	e2beeb3	lightgbm_lower_lr_more_iter	keep	0.18110000	candidate	not_segmentation	0.18370000	-0.01040000	217.97350000	0.19650000	-0.05750000	25.02		Best 0.1851 with leaves 15/24, LR 0.04/0.035. Try lower LR (0.03/0.025) with more rounds for more stable convergence.
20260428_135048_efbef3a_lightgbm_slightly_more_aggressive	efbef3a	lightgbm_slightly_more_aggressive	keep	0.17785000	candidate	not_segmentation	0.18200000	-0.01660000	217.35840000	0.19510000	-0.05800000	18.29		Current best: Gini 0.1851, calibration -0.98%, MAE 218.07. Try slightly lower min_data (~20%) to find finer splits.
20260428_135145_efbef3a_lightgbm_best_variant	efbef3a	lightgbm_best_variant	keep	0.17875000	candidate	not_segmentation	0.18200000	-0.01300000	217.74700000	0.19330000	-0.04960000	18.10		Best: leaves 15/24, LR 0.04/0.035. Try leaves 14/22 with same LR - simpler model might generalize better.
20260428_135225_efbef3a_lightgbm_boosting_rounds	efbef3a	lightgbm_boosting_rounds	keep	0.18027500	candidate	not_segmentation	0.18380000	-0.01410000	217.57990000	0.20090000	-0.03990000	21.51		Try less feature_fraction (0.75/0.70) to force more diversity. Also more boosting rounds to compensate.
20260428_135310_efbef3a_lightgbm_optimal_balance	efbef3a	lightgbm_optimal_balance	discard	0.18182500	not_pricing	not_segmentation	0.18480000	-0.01190000	217.81110000	0.19340000	-0.05430000	19.31	pricing_raw_gini_not_materially_worse;segmentation_minimum_capped_gini_gain	Best still 0.1851. Try intermediate: 16/23 leaves, 0.042 LR to find optimum between capacity and overfitting.
20260428_135703_32198a3_lightgbm_tweedie_direct	32198a3	lightgbm_tweedie_direct	keep	0.18265000	candidate	not_segmentation	0.18510000	-0.00980000	218.06870000	0.20040000	-0.04940000	17.93		NEW HYPOTHESIS: Use Tweedie objective (variance_power=1.5) to optimize pure premium directly. Actuarially better than frequency x severity separate models.
20260428_135742_32198a3_lightgbm_class_weight	32198a3	lightgbm_class_weight	discard	0.18265000	not_pricing	not_segmentation	0.18510000	-0.00980000	218.06870000	0.20040000	-0.04940000	18.69	pricing_material_improvement;segmentation_minimum_capped_gini_gain	NEW HYPOTHESIS: Frequency has class imbalance (only ~3.5% have claims). Use scale_pos_weight to give more weight to claim events.
20260428_135822_32198a3_lightgbm_huber_loss	32198a3	lightgbm_huber_loss	discard	0.18265000	not_pricing	not_segmentation	0.18510000	-0.00980000	218.06870000	0.20040000	-0.04940000	19.01	pricing_material_improvement;segmentation_minimum_capped_gini_gain	NEW HYPOTHESIS: Use Huber loss for robustness to outliers in severity. Poisson/Gamma are sensitive to extreme claims.
20260428_135919_32198a3_lightgbm_dart_booster	32198a3	lightgbm_dart_booster	discard	0.18265000	not_pricing	not_segmentation	0.18510000	-0.00980000	218.06870000	0.20040000	-0.04940000	18.96	pricing_material_improvement;segmentation_minimum_capped_gini_gain	NEW HYPOTHESIS: Use DART booster ( dropout + tree) instead of GBDT. Drops trees during training to reduce overfitting.
20260428_140957_17ea673_lightgbm_higher_early_stop	17ea673	lightgbm_higher_early_stop	discard	0.18195000	not_pricing	not_segmentation	0.18440000	-0.00980000	218.01960000	0.19990000	-0.04930000	19.50	pricing_material_improvement;segmentation_minimum_capped_gini_gain	NEW HYPOTHESIS: Use more aggressive early stopping (25-30 rounds vs 15). Find more optimal stopping point - less overfitting.
20260428_141045_17ea673_lightgbm_best_seed_avg	17ea673	lightgbm_best_seed_avg	discard	0.18090000	not_pricing	not_segmentation	0.18620000	-0.02120000	219.55560000	0.25860000	-0.06310000	18.06	pricing_capped_rmse_tolerance;segmentation_minimum_capped_gini_gain;segmentation_minimum_fold_agreement;segmentation_capped_rmse_tolerance	NEW HYPOTHESIS: Use slightly different seed (20260428 vs 20260423). Test if different random initialization finds better solution.
20260428_141202_5a46070_lightgbm_smoother_more_reg	5a46070	lightgbm_smoother_more_reg	discard	0.18205000	not_pricing	not_segmentation	0.18470000	-0.01060000	217.98200000	0.20030000	-0.04360000	18.50	pricing_material_improvement;segmentation_minimum_capped_gini_gain	NEW HYPOTHESIS: Strengthen L2 regularization (12-15 vs 8-10) to reduce variance. Previous run hit 0.1862 but high MAE - overfitting.
20260428_141239_5a46070_lightgbm_fewer_leaves_better	5a46070	lightgbm_fewer_leaves_better	discard	0.18002500	not_pricing	not_segmentation	0.18290000	-0.01150000	217.88690000	0.19910000	-0.05190000	17.19	pricing_material_improvement;segmentation_minimum_capped_gini_gain;segmentation_minimum_fold_agreement	NEW HYPOTHESIS: Try simpler model - fewer leaves (12/20 vs 15/24). May generalize better despite less capacity.
20260428_141326_5a46070_lightgbm_aggressive_lr	5a46070	lightgbm_aggressive_lr	keep	0.17835000	candidate	not_segmentation	0.18360000	-0.02100000	216.90250000	0.19890000	-0.04470000	15.81		NEW HYPOTHESIS: Try very high learning rate (0.05/0.045) with stronger min_data to balance. Faster convergence.
20260428_141407_5a46070_lightgbm_optimal_balance_v2	5a46070	lightgbm_optimal_balance_v2	keep	0.17732500	candidate	not_segmentation	0.18230000	-0.01990000	216.98210000	0.19560000	-0.04910000	17.91		Combine findings: aggressive LR (0.05) with best settings (leaves 15/24). Best MAE was 216.90 with 0.1836 Gini. Try to get both.
20260428_141505_e474e4b_lightgbm_optimal_exploration	e474e4b	lightgbm_optimal_exploration	keep	0.17895000	candidate	not_segmentation	0.18340000	-0.01780000	217.13820000	0.19510000	-0.06100000	21.02		Final exploration: 18 leaves at 0.048 LR, extreme L2=15 for safety. Testing boundary of hyperparameter space.
20260428_142141_1fc5443_lightgbm_deeper_less_reg	1fc5443	lightgbm_deeper_less_reg	discard	0.17580000	not_pricing	not_segmentation	0.18030000	-0.01800000	217.15760000	0.19680000	-0.05150000	19.21	pricing_material_improvement;segmentation_minimum_capped_gini_gain;segmentation_minimum_fold_agreement	NEW: Try deeper trees (17-26) with reduced regularization (L2=5). Opposite of best - see if different optima found.
20260428_142222_1fc5443_lightgbm_varying_gamma	1fc5443	lightgbm_varying_gamma	keep	0.18272500	candidate	not_segmentation	0.18520000	-0.00990000	218.07140000	0.20060000	-0.04950000	18.52		NEW: Use varying gamma for severity - lower gamma=1.2 (closer to Gaussian) for stability vs standard 1.5 tweedie.
20260428_142317_1fc5443_lightgbm_mid_leaves_mid_reg	1fc5443	lightgbm_mid_leaves_mid_reg	discard	0.17885000	not_pricing	not_segmentation	0.18310000	-0.01700000	217.31570000	0.19420000	-0.05010000	18.30	pricing_raw_gini_not_materially_worse;segmentation_minimum_capped_gini_gain;segmentation_minimum_fold_agreement	NEW: Mid leaves (16/22) mid L2 (7) - search middle ground. Previous best 0.1851-0.1852.
20260428_142407_1fc5443_lightgbm_compact_search	1fc5443	lightgbm_compact_search	discard	0.17865000	not_pricing	not_segmentation	0.18160000	-0.01180000	217.88410000	0.20160000	-0.03990000	17.82	pricing_material_improvement;segmentation_minimum_capped_gini_gain	NEW: Compact search 13-19 leaves, higher min_data, higher feature fraction. Different direction from standard.
20260428_142447_1fc5443_lightgbm_extreme_bagging	1fc5443	lightgbm_extreme_bagging	keep	0.17812500	candidate	not_segmentation	0.18170000	-0.01430000	217.61750000	0.19970000	-0.03590000	19.20		NEW: High bagging fraction (0.92) more randomness, lower feature fraction (0.75). Maximum diversity approach.
20260428_142530_1fc5443_lightgbm_very_high_lr	1fc5443	lightgbm_very_high_lr	keep	0.18045000	candidate	not_segmentation	0.18380000	-0.01340000	217.71510000	0.19710000	-0.04690000	15.30		NEW: Very high LR (0.055/0.05) with high min_data. Aggressive learning.
20260428_142610_1fc5443_lightgbm_mid_high_lr	1fc5443	lightgbm_mid_high_lr	keep	0.17967500	candidate	not_segmentation	0.18430000	-0.01850000	217.14240000	0.19900000	-0.04320000	17.57		NEW: Mid-high LR (0.048/0.043) with very high min_data. Balance exploration.
20260428_142653_1fc5443_lightgbm_exact_best_plus	1fc5443	lightgbm_exact_best_plus	discard	0.17940000	not_pricing	not_segmentation	0.18290000	-0.01400000	217.59230000	0.19280000	-0.05790000	20.04	pricing_raw_gini_not_materially_worse;segmentation_minimum_capped_gini_gain;segmentation_raw_gini_not_materially_worse	Exact best config with tiny variation: leaves 16/25, LR 0.041/0.036. Slight variation from 15/24 0.04/0.035.
20260428_142751_1fc5443_lightgbm_17_25_explore	1fc5443	lightgbm_17_25_explore	keep	0.18107500	candidate	not_segmentation	0.18380000	-0.01090000	217.92950000	0.19410000	-0.05110000	20.17		17/25 leaves, 0.042 LR, 11 L2. Different from 15/24.
20260428_142836_1fc5443_lightgbm_18_26_lr043	1fc5443	lightgbm_18_26_lr043	discard	0.18017500	not_pricing	not_segmentation	0.18330000	-0.01250000	217.72630000	0.19700000	-0.04710000	20.18	pricing_material_improvement;segmentation_minimum_capped_gini_gain	18/26 leaves, 0.043 LR, lower L2 (7-8). More trees.
20260428_142915_1fc5443_lightgbm_13_21_balanced	1fc5443	lightgbm_13_21_balanced	keep	0.17785000	candidate	not_segmentation	0.18220000	-0.01740000	217.27050000	0.19790000	-0.04780000	18.63		13/21 leaves, 0.044 LR, higher L2 (12). More regularization.
20260428_142949_1fc5443_lightgbm_14_23_med_lr	1fc5443	lightgbm_14_23_med_lr	keep	0.17912500	candidate	not_segmentation	0.18280000	-0.01470000	217.51890000	0.19910000	-0.04480000	18.36		14/23 leaves, 0.045 LR, medium L2. Alternative.
20260428_143047_1fc5443_lightgbm_15_24_v2	1fc5443	lightgbm_15_24_v2	discard	0.17722500	not_pricing	not_segmentation	0.18090000	-0.01470000	217.52880000	0.19600000	-0.05710000	18.66	pricing_material_improvement;segmentation_minimum_capped_gini_gain;segmentation_minimum_fold_agreement	15/24 leaves exactly as best, but 0.04/0.035 + L2 8-9. Same as champion.
20260428_143129_1fc5443_lightgbm_15_24_low_lr	1fc5443	lightgbm_15_24_low_lr	discard	0.17557500	not_pricing	not_segmentation	0.18000000	-0.01770000	217.19550000	0.19630000	-0.05520000	21.21	pricing_material_improvement;segmentation_minimum_capped_gini_gain;segmentation_minimum_fold_agreement	15/24 with lower LR (0.038/0.033). More boosting rounds.
20260428_143206_1fc5443_lightgbm_12_20_high_min	1fc5443	lightgbm_12_20_high_min	discard	0.17925000	not_pricing	not_segmentation	0.18320000	-0.01580000	217.43090000	0.19830000	-0.05220000	20.03	pricing_material_improvement;segmentation_minimum_capped_gini_gain	12/20 leaves + very high min_data (2000+). Simpler model.
20260428_143635_1fc5443_catboost_baseline	1fc5443	catboost_baseline	discard	0.13720000	not_pricing	not_segmentation	0.13770000	0.00200000	219.63710000	0.14230000	0.00880000	15.32	pricing_transparent_model_or_documented_blend;pricing_capped_gini_not_materially_worse;pricing_raw_gini_not_materially_worse;segmentation_minimum_capped_gini_gain;segmentation_minimum_fold_agreement;segmentation_raw_gini_not_materially_worse	CatBoost instead of LightGBM. Different gradient boosting algorithm. May find different patterns.
20260428_143723_1fc5443_lightgbm_deep_diversity	1fc5443	lightgbm_deep_diversity	keep	0.18102500	candidate	not_segmentation	0.18450000	-0.01390000	217.62310000	0.19870000	-0.07160000	22.62		Deep diversity: 0.70 feature fraction + 0.70 bagging. Max randomization + more regularization. Break 0.185 ceiling.
20260428_143813_1fc5443_lightgbm_extreme_random	1fc5443	lightgbm_extreme_random	keep	0.18032500	candidate	not_segmentation	0.18550000	-0.02070000	216.96550000	0.20250000	-0.04290000	22.89		Extreme randomization: feature 0.6 / bagging 0.6. Maximum diversity from standard config.
20260428_143854_1fc5443_lightgbm_extreme_variant	1fc5443	lightgbm_extreme_variant	keep	0.18190000	candidate	not_segmentation	0.18740000	-0.02200000	216.84220000	0.20050000	-0.08600000	25.02		Extreme variant: feature 0.55 / bagging 0.55. Even more randomization.
20260428_143936_1fc5443_lightgbm_ultra_random	1fc5443	lightgbm_ultra_random	discard	0.17867500	not_pricing	not_segmentation	0.18430000	-0.02250000	216.81610000	0.20540000	-0.07320000	28.70	pricing_material_improvement;segmentation_minimum_capped_gini_gain	Ultra randomization: feature 0.5 / bagging 0.5 + more leaves + higher L2. Maximum exploration.
20260428_144034_1fc5443_lightgbm_optimal_random	1fc5443	lightgbm_optimal_random	discard	0.17772500	not_pricing	not_segmentation	0.18310000	-0.02150000	216.86690000	0.19990000	-0.03790000	24.43	pricing_material_improvement;segmentation_minimum_capped_gini_gain;segmentation_minimum_fold_agreement	Optimal randomization: feature 0.58 / bagging 0.58 + 16/25 leaves. Fine-tune around 0.1874 winner.
20260428_144115_1fc5443_lightgbm_extreme_v2	1fc5443	lightgbm_extreme_v2	keep	0.18242500	candidate	not_segmentation	0.18640000	-0.01590000	217.47890000	0.21050000	-0.07260000	24.98		Extreme v2: feature 0.54 / bagging 0.54 + 17/26 leaves + lower L2. Variation on 0.1874 winner.
20260428_144201_1fc5443_lightgbm_diverse_sweet	1fc5443	lightgbm_diverse_sweet	keep	0.18682500	candidate	candidate	0.18970000	-0.01150000	217.92800000	0.21400000	-0.06450000	24.92		Diverse sweet: feature 0.52 / bagging 0.52 + 15/23 leaves + moderate L2. Different leaf config.
20260428_144243_1fc5443_lightgbm_diverse_v2	1fc5443	lightgbm_diverse_v2	discard	0.17930000	not_pricing	not_segmentation	0.18570000	-0.02560000	216.41980000	0.20420000	-0.06510000	27.14	pricing_raw_gini_not_materially_worse;segmentation_minimum_capped_gini_gain;segmentation_minimum_fold_agreement;segmentation_raw_gini_not_materially_worse	Diverse v2: feature 0.50 / bagging 0.50 + 14/22 leaves. Push randomization further.
20260428_144327_1fc5443_lightgbm_diverse_v3	1fc5443	lightgbm_diverse_v3	discard	0.18150000	not_pricing	not_segmentation	0.18490000	-0.01360000	217.73320000	0.21230000	-0.07480000	25.03	pricing_material_improvement;segmentation_minimum_capped_gini_gain;segmentation_minimum_fold_agreement	Diverse v3: feature 0.53 / bagging 0.53 + 16/24 leaves. Fine-tune around 0.1897 winner.
20260428_144408_1fc5443_lightgbm_diverse_repro	1fc5443	lightgbm_diverse_repro	discard	0.18682500	not_pricing	not_segmentation	0.18970000	-0.01150000	217.92800000	0.21400000	-0.06450000	24.87	pricing_material_improvement;segmentation_minimum_capped_gini_gain;segmentation_minimum_fold_agreement	Diverse repro: feature 0.52 / bagging 0.52 + 15/23 leaves. Exact same as 0.1897 winner.
20260428_144449_1fc5443_lightgbm_19_breaker	1fc5443	lightgbm_19_breaker	discard	0.17895000	not_pricing	not_segmentation	0.18420000	-0.02100000	216.92960000	0.21030000	-0.07250000	24.80	pricing_capped_gini_not_materially_worse;segmentation_minimum_capped_gini_gain;segmentation_minimum_fold_agreement	0.19 breaker: feature 0.51 / bagging 0.51 + 15/23 leaves + slightly lower L2. Push for 0.19+.
20260428_144549_1fc5443_lightgbm_diverse_closer	1fc5443	lightgbm_diverse_closer	keep	0.18755000	candidate	not_segmentation	0.19000000	-0.00980000	218.09510000	0.21210000	-0.06600000	24.66		Diverse closer: feature 0.515 / bagging 0.515 + 16/24 leaves. Between winner and v2.
20260428_144647_1fc5443_lightgbm_19_plus	1fc5443	lightgbm_19_plus	discard	0.17862500	not_pricing	not_segmentation	0.18330000	-0.01870000	217.15760000	0.21000000	-0.07320000	25.06	pricing_capped_gini_not_materially_worse;segmentation_minimum_capped_gini_gain;segmentation_minimum_fold_agreement	19+ push: feature 0.508 / bagging 0.508 + 15/23 + lower min_data. Push above 0.19.
20260428_144733_1fc5443_lightgbm_19_final	1fc5443	lightgbm_19_final	discard	0.18837500	not_pricing	not_segmentation	0.19080000	-0.00970000	218.10510000	0.21370000	-0.06590000	25.10	pricing_material_improvement;segmentation_minimum_capped_gini_gain	19 final: feature 0.515 / bagging 0.515 + 16/24 + L2 13.4/11.4. Exact variation on 0.1900.
20260428_144817_1fc5443_lightgbm_191_push	1fc5443	lightgbm_191_push	discard	0.17985000	not_pricing	not_segmentation	0.18480000	-0.01980000	217.04420000	0.21300000	-0.06590000	25.58	pricing_capped_gini_not_materially_worse;segmentation_minimum_capped_gini_gain;segmentation_minimum_fold_agreement	0.191 push: feature 0.512 / bagging 0.512 + 16/24 + L2 12.8/10.8. Push beyond 0.1908.
20260428_145040_1fc5443_lightgbm_191_v2	1fc5443	lightgbm_191_v2	keep	0.18135000	candidate	not_segmentation	0.18640000	-0.02020000	217.02900000	0.21290000	-0.06580000	24.29		0.191 v2: feature 0.518 / bagging 0.518 + 16/24 + L2 13.8/11.8. Variation on 0.1908.
20260428_145121_1fc5443_lightgbm_191_exact	1fc5443	lightgbm_191_exact	keep	0.18837500	candidate	not_segmentation	0.19080000	-0.00970000	218.10510000	0.21370000	-0.06590000	25.40		0.191 exact: feature 0.515 / bagging 0.515 + 16/24 + exact L2 from 0.1908. Exact reproduction attempt.
20260428_145205_1fc5443_lightgbm_191_slight	1fc5443	lightgbm_191_slight	discard	0.17717500	not_pricing	not_segmentation	0.18270000	-0.02210000	216.80090000	0.21430000	-0.06610000	25.44	pricing_capped_gini_not_materially_worse;segmentation_minimum_capped_gini_gain;segmentation_minimum_fold_agreement	0.191 slight: feature 0.513 / bagging 0.513 + 15/23 + L2 13.0/11.0. Slight leaf reduction.
20260428_145248_1fc5443_lightgbm_191_more_rounds	1fc5443	lightgbm_191_more_rounds	discard	0.18507500	not_pricing	not_segmentation	0.18820000	-0.01250000	217.79460000	0.20740000	-0.06580000	25.58	pricing_material_improvement;pricing_raw_gini_not_materially_worse;segmentation_minimum_capped_gini_gain;segmentation_minimum_fold_agreement;segmentation_raw_gini_not_materially_worse	0.191 more: feature 0.515 / bagging 0.515 + 16/24 + 180 rounds. More boosting rounds.
