run_id	commit	candidate_id	status	selection_score	pricing_status	segmentation_status	capped_pp_gini_mean	capped_pp_calibration_gap_mean	capped_pp_mae_mean	raw_pp_gini_mean	raw_pp_calibration_gap_mean	runtime_seconds	gate_failures	description
20260428_171608_eca7abe_lightgbm_ft_0001	eca7abe	lightgbm_ft_0001	discard	0.18632500	not_pricing	not_segmentation	0.19010000	-0.01510000	217.50760000	0.20850000	-0.06750000	26.53	pricing_material_improvement;segmentation_minimum_capped_gini_gain;segmentation_minimum_fold_agreement;segmentation_raw_gini_not_materially_worse	Fine-tune: leaves. FF=0.515, L2=13.2
20260428_171635_71821c4_lightgbm_ft_0002	71821c4	lightgbm_ft_0002	discard	0.18562500	not_pricing	not_segmentation	0.18940000	-0.01510000	217.50910000	0.20860000	-0.06740000	28.70	pricing_material_improvement;segmentation_minimum_capped_gini_gain;segmentation_minimum_fold_agreement;segmentation_raw_gini_not_materially_worse	Fine-tune: l2. FF=0.515, L2=12.9
20260428_171940_0871ab5_lightgbm_ex_0001	0871ab5	lightgbm_ex_0001	discard	0.18402500	not_pricing	not_segmentation	0.18810000	-0.01630000	217.47130000	0.21430000	-0.07320000	28.02	pricing_material_improvement;segmentation_minimum_capped_gini_gain;segmentation_minimum_fold_agreement	EXPLORE: FF=0.494, L2=13.9, leaves=17
20260428_172009_5e3f0ee_lightgbm_ft_0002	5e3f0ee	lightgbm_ft_0002	keep	0.18422500	candidate	not_segmentation	0.18750000	-0.01310000	217.73050000	0.21060000	-0.07300000	27.52		FINE_TUNE: FF=0.520, L2=13.2, leaves=15
20260428_172038_dfd2367_lightgbm_ft_0003	dfd2367	lightgbm_ft_0003	discard	0.18067500	not_pricing	not_segmentation	0.18480000	-0.01650000	217.39160000	0.21140000	-0.07320000	28.07	pricing_material_improvement;segmentation_minimum_capped_gini_gain;segmentation_minimum_fold_agreement	FINE_TUNE: FF=0.508, L2=13.3, leaves=16
20260428_172108_4078e19_lightgbm_ft_0004	4078e19	lightgbm_ft_0004	discard	0.18432500	not_pricing	not_segmentation	0.18770000	-0.01350000	217.69090000	0.21230000	-0.06950000	27.21	pricing_material_improvement;segmentation_minimum_capped_gini_gain;segmentation_minimum_fold_agreement	FINE_TUNE: FF=0.518, L2=13.4, leaves=15
20260428_172136_e350df0_lightgbm_ft_0005	e350df0	lightgbm_ft_0005	keep	0.17967500	candidate	not_segmentation	0.18530000	-0.02250000	216.76650000	0.20880000	-0.07630000	28.77		FINE_TUNE: FF=0.517, L2=12.6, leaves=16
20260428_172207_8026420_lightgbm_ex_0006	8026420	lightgbm_ex_0006	keep	0.18010000	candidate	not_segmentation	0.18530000	-0.02080000	216.99790000	0.21240000	-0.07640000	31.21		EXPLORE: FF=0.482, L2=11.2, leaves=19
20260428_172314_3fc68df_lightgbm_restart	3fc68df	lightgbm_restart	keep	0.18847500	candidate	not_segmentation	0.19090000	-0.00970000	218.10740000	0.21400000	-0.06580000	25.69		Restart with champion config
20260428_172606_3fc68df_lightgbm_explore_0001	3fc68df	lightgbm_explore_0001	discard	0.17952500	not_pricing	not_segmentation	0.18500000	-0.02190000	216.87950000	0.21310000	-0.07010000	28.08	pricing_capped_gini_not_materially_worse;segmentation_minimum_capped_gini_gain;segmentation_minimum_fold_agreement	EXPLORE: FF=0.489 L2=15.9 L=16
20260428_172634_3fc68df_lightgbm_fine_tune_0002	3fc68df	lightgbm_fine_tune_0002	discard	0.18285000	not_pricing	not_segmentation	0.18730000	-0.01780000	217.23330000	0.20830000	-0.07600000	29.30	pricing_raw_gini_not_materially_worse;segmentation_minimum_capped_gini_gain;segmentation_minimum_fold_agreement;segmentation_raw_gini_not_materially_worse	FINE_TUNE: FF=0.517 L2=13.4 L=18
20260428_172704_3fc68df_lightgbm_explore_0003	3fc68df	lightgbm_explore_0003	discard	0.18097500	not_pricing	not_segmentation	0.18560000	-0.01850000	217.27160000	0.21230000	-0.07420000	38.56	pricing_capped_gini_not_materially_worse;segmentation_minimum_capped_gini_gain;segmentation_minimum_fold_agreement	EXPLORE: FF=0.500 L2=11.9 L=21
20260428_172743_3fc68df_lightgbm_fine_tune_0004	3fc68df	lightgbm_fine_tune_0004	discard	0.18200000	not_pricing	not_segmentation	0.18620000	-0.01680000	217.35220000	0.20610000	-0.06800000	32.76	pricing_raw_gini_not_materially_worse;segmentation_minimum_capped_gini_gain;segmentation_minimum_fold_agreement;segmentation_raw_gini_not_materially_worse	FINE_TUNE: FF=0.523 L2=12.6 L=15
20260428_172816_3fc68df_lightgbm_fine_tune_0005	3fc68df	lightgbm_fine_tune_0005	discard	0.18012500	not_pricing	not_segmentation	0.18520000	-0.02030000	216.99480000	0.21300000	-0.07300000	29.53	pricing_capped_gini_not_materially_worse;segmentation_minimum_capped_gini_gain;segmentation_minimum_fold_agreement	FINE_TUNE: FF=0.513 L2=13.4 L=16
20260428_172846_3fc68df_lightgbm_fine_tune_0006	3fc68df	lightgbm_fine_tune_0006	discard	0.18030000	not_pricing	not_segmentation	0.18520000	-0.01960000	217.05890000	0.21190000	-0.07290000	29.88	pricing_capped_gini_not_materially_worse;segmentation_minimum_capped_gini_gain;segmentation_minimum_fold_agreement	FINE_TUNE: FF=0.514 L2=12.7 L=18
20260428_172916_3fc68df_lightgbm_fine_tune_0007	3fc68df	lightgbm_fine_tune_0007	discard	0.18505000	not_pricing	not_segmentation	0.18830000	-0.01300000	217.72760000	0.21140000	-0.07220000	30.31	pricing_material_improvement;segmentation_minimum_capped_gini_gain;segmentation_minimum_fold_agreement	FINE_TUNE: FF=0.521 L2=13.3 L=18
20260428_172947_3fc68df_lightgbm_fine_tune_0008	3fc68df	lightgbm_fine_tune_0008	keep	0.18157500	candidate	not_segmentation	0.18650000	-0.01970000	217.04250000	0.21310000	-0.07320000	30.21		FINE_TUNE: FF=0.516 L2=13.2 L=18
20260428_173017_3fc68df_lightgbm_explore_0009	3fc68df	lightgbm_explore_0009	discard	0.18022500	not_pricing	not_segmentation	0.18490000	-0.01870000	217.25670000	0.21230000	-0.07410000	32.16	pricing_material_improvement;segmentation_minimum_capped_gini_gain;segmentation_minimum_fold_agreement	EXPLORE: FF=0.499 L2=10.2 L=17
20260428_173050_3fc68df_lightgbm_fine_tune_0010	3fc68df	lightgbm_fine_tune_0010	discard	0.18157500	not_pricing	not_segmentation	0.18680000	-0.02090000	216.94560000	0.21270000	-0.06640000	30.52	pricing_material_improvement;segmentation_minimum_capped_gini_gain;segmentation_minimum_fold_agreement	FINE_TUNE: FF=0.511 L2=12.9 L=17
20260428_173120_3fc68df_lightgbm_explore_0011	3fc68df	lightgbm_explore_0011	keep	0.18575000	candidate	not_segmentation	0.18850000	-0.01100000	217.93390000	0.21050000	-0.07390000	30.61		EXPLORE: FF=0.516 L2=11.1 L=17
20260428_173151_3fc68df_lightgbm_fine_tune_0012	3fc68df	lightgbm_fine_tune_0012	discard	0.18532500	not_pricing	not_segmentation	0.18850000	-0.01270000	217.76640000	0.21030000	-0.08270000	29.62	pricing_material_improvement;segmentation_minimum_capped_gini_gain;segmentation_minimum_fold_agreement	FINE_TUNE: FF=0.518 L2=13.4 L=15
20260428_173221_3fc68df_lightgbm_fine_tune_0013	3fc68df	lightgbm_fine_tune_0013	keep	0.18280000	candidate	not_segmentation	0.18730000	-0.01800000	217.25860000	0.21270000	-0.06980000	29.86		FINE_TUNE: FF=0.507 L2=13.0 L=16
20260428_173251_3fc68df_lightgbm_explore_0014	3fc68df	lightgbm_explore_0014	keep	0.18272500	candidate	not_segmentation	0.18680000	-0.01630000	217.47030000	0.21500000	-0.07430000	32.75		EXPLORE: FF=0.493 L2=13.9 L=18
20260428_173325_3fc68df_lightgbm_fine_tune_0015	3fc68df	lightgbm_fine_tune_0015	discard	0.18440000	not_pricing	not_segmentation	0.18780000	-0.01360000	217.66780000	0.20680000	-0.06850000	32.67	pricing_raw_gini_not_materially_worse;segmentation_minimum_capped_gini_gain;segmentation_minimum_fold_agreement;segmentation_raw_gini_not_materially_worse	FINE_TUNE: FF=0.520 L2=13.2 L=17
20260428_173358_3fc68df_lightgbm_fine_tune_0016	3fc68df	lightgbm_fine_tune_0016	keep	0.18200000	candidate	not_segmentation	0.18570000	-0.01480000	217.56000000	0.21220000	-0.06600000	30.12		FINE_TUNE: FF=0.522 L2=12.8 L=14
20260428_173428_3fc68df_lightgbm_fine_tune_0017	3fc68df	lightgbm_fine_tune_0017	keep	0.18490000	candidate	not_segmentation	0.18770000	-0.01120000	217.92200000	0.20830000	-0.07580000	32.61		FINE_TUNE: FF=0.521 L2=13.3 L=16
20260428_173501_3fc68df_lightgbm_fine_tune_0018	3fc68df	lightgbm_fine_tune_0018	keep	0.18537500	candidate	not_segmentation	0.18870000	-0.01330000	217.70600000	0.21150000	-0.07250000	31.93		FINE_TUNE: FF=0.519 L2=12.6 L=17
20260428_173533_3fc68df_lightgbm_fine_tune_0019	3fc68df	lightgbm_fine_tune_0019	keep	0.18012500	candidate	not_segmentation	0.18480000	-0.01870000	217.16900000	0.21000000	-0.07350000	30.60		FINE_TUNE: FF=0.518 L2=12.6 L=15
20260428_173707_3fc68df_lightgbm_fine_tune_0001	3fc68df	lightgbm_fine_tune_0001	keep	0.18490000	candidate	not_segmentation	0.18770000	-0.01120000	217.92210000	0.20960000	-0.07290000	28.11		FINE_TUNE: FF=0.521 L2=13.0 L=16
20260428_173735_50296a9_lightgbm_fine_tune_0002	50296a9	lightgbm_fine_tune_0002	keep	0.18090000	candidate	not_segmentation	0.18600000	-0.02040000	216.98510000	0.21290000	-0.07290000	28.79		FINE_TUNE: FF=0.509 L2=12.9 L=17
20260428_173805_00bc018_lightgbm_fine_tune_0003	00bc018	lightgbm_fine_tune_0003	keep	0.18152500	candidate	not_segmentation	0.18520000	-0.01470000	217.56800000	0.20990000	-0.07230000	28.25		FINE_TUNE: FF=0.522 L2=13.3 L=14
20260428_173833_abf6426_lightgbm_explore_0004	abf6426	lightgbm_explore_0004	keep	0.18405000	candidate	not_segmentation	0.18740000	-0.01340000	217.69720000	0.20570000	-0.06840000	29.60		EXPLORE: FF=0.520 L2=13.2 L=17
20260428_173903_1736e05_lightgbm_fine_tune_0005	1736e05	lightgbm_fine_tune_0005	keep	0.18645000	candidate	not_segmentation	0.18960000	-0.01260000	217.76740000	0.21030000	-0.07330000	29.08		FINE_TUNE: FF=0.518 L2=12.9 L=18
20260428_173933_f4da535_lightgbm_fine_tune_0006	f4da535	lightgbm_fine_tune_0006	discard	0.18407500	not_pricing	not_segmentation	0.18740000	-0.01330000	217.71650000	0.21000000	-0.06660000	28.06	pricing_material_improvement;segmentation_minimum_capped_gini_gain;segmentation_minimum_fold_agreement	FINE_TUNE: FF=0.519 L2=13.2 L=14
20260428_174002_f2b3cd2_lightgbm_fine_tune_0007	f2b3cd2	lightgbm_fine_tune_0007	keep	0.18165000	candidate	not_segmentation	0.18680000	-0.02060000	216.97670000	0.21280000	-0.07230000	28.80		FINE_TUNE: FF=0.511 L2=13.1 L=16
20260428_174031_273f747_lightgbm_fine_tune_0008	273f747	lightgbm_fine_tune_0008	keep	0.18222500	candidate	not_segmentation	0.18590000	-0.01470000	217.56740000	0.21110000	-0.07230000	28.97		FINE_TUNE: FF=0.522 L2=13.4 L=15
20260428_174100_76604e3_lightgbm_fine_tune_0009	76604e3	lightgbm_fine_tune_0009	keep	0.18070000	candidate	not_segmentation	0.18580000	-0.02040000	216.99890000	0.21210000	-0.07260000	29.10		FINE_TUNE: FF=0.511 L2=13.0 L=15
20260428_174130_ee95133_lightgbm_fine_tune_0010	ee95133	lightgbm_fine_tune_0010	discard	0.18022500	not_pricing	not_segmentation	0.18530000	-0.02030000	216.98530000	0.21390000	-0.07350000	28.87	pricing_material_improvement;segmentation_minimum_capped_gini_gain;segmentation_minimum_fold_agreement	FINE_TUNE: FF=0.513 L2=12.7 L=17
20260428_174159_5f78779_lightgbm_fine_tune_0011	5f78779	lightgbm_fine_tune_0011	keep	0.17965000	candidate	not_segmentation	0.18440000	-0.01900000	217.14380000	0.21060000	-0.08230000	27.94		FINE_TUNE: FF=0.518 L2=13.3 L=15
20260428_174228_813ec4b_lightgbm_fine_tune_0012	813ec4b	lightgbm_fine_tune_0012	keep	0.18130000	candidate	not_segmentation	0.18620000	-0.01960000	217.07480000	0.20960000	-0.07370000	28.37		FINE_TUNE: FF=0.510 L2=12.7 L=15
20260428_174257_895b45f_lightgbm_fine_tune_0013	895b45f	lightgbm_fine_tune_0013	keep	0.18627500	candidate	not_segmentation	0.18910000	-0.01130000	217.91760000	0.20850000	-0.06850000	28.93		FINE_TUNE: FF=0.516 L2=13.1 L=16
20260428_174326_ddea330_lightgbm_fine_tune_0014	ddea330	lightgbm_fine_tune_0014	discard	0.18422500	not_pricing	not_segmentation	0.18760000	-0.01350000	217.68370000	0.21230000	-0.07350000	29.00	pricing_material_improvement;segmentation_minimum_capped_gini_gain;segmentation_minimum_fold_agreement	FINE_TUNE: FF=0.518 L2=13.0 L=16
20260428_174355_381be8a_lightgbm_fine_tune_0015	381be8a	lightgbm_fine_tune_0015	keep	0.18010000	candidate	not_segmentation	0.18560000	-0.02200000	216.83390000	0.21220000	-0.06630000	27.90		FINE_TUNE: FF=0.511 L2=12.7 L=15
20260428_174424_1750efb_lightgbm_fine_tune_0016	1750efb	lightgbm_fine_tune_0016	keep	0.18135000	candidate	not_segmentation	0.18630000	-0.01980000	217.05660000	0.21250000	-0.06940000	28.59		FINE_TUNE: FF=0.510 L2=13.3 L=16
20260428_174453_c47f370_lightgbm_explore_0017	c47f370	lightgbm_explore_0017	discard	0.18775000	not_pricing	not_segmentation	0.18920000	-0.00580000	218.50110000	0.20610000	-0.07780000	29.66	pricing_raw_gini_not_materially_worse;segmentation_minimum_capped_gini_gain;segmentation_minimum_fold_agreement;segmentation_raw_gini_not_materially_worse	EXPLORE: FF=0.528 L2=13.5 L=20
20260428_174523_3e0ade1_lightgbm_fine_tune_0018	3e0ade1	lightgbm_fine_tune_0018	discard	0.18190000	not_pricing	not_segmentation	0.18700000	-0.02040000	216.97760000	0.21380000	-0.07270000	28.61	pricing_material_improvement;segmentation_minimum_capped_gini_gain;segmentation_minimum_fold_agreement	FINE_TUNE: FF=0.512 L2=13.0 L=17
20260428_174552_6969764_lightgbm_explore_0019	6969764	lightgbm_explore_0019	discard	0.18142500	not_pricing	not_segmentation	0.18510000	-0.01470000	217.54520000	0.20590000	-0.06830000	29.16	pricing_raw_gini_not_materially_worse;segmentation_minimum_capped_gini_gain;segmentation_minimum_fold_agreement;segmentation_raw_gini_not_materially_worse	EXPLORE: FF=0.523 L2=10.2 L=21
20260428_174622_f56fbed_lightgbm_fine_tune_0020	f56fbed	lightgbm_fine_tune_0020	discard	0.17730000	not_pricing	not_segmentation	0.18320000	-0.02360000	216.64890000	0.21170000	-0.07270000	28.30	pricing_material_improvement;segmentation_minimum_capped_gini_gain;segmentation_minimum_fold_agreement	FINE_TUNE: FF=0.518 L2=12.6 L=15
20260428_174753_59f5be1_lightgbm_best_191	59f5be1	lightgbm_best_191	keep	0.18847500	candidate	not_segmentation	0.19090000	-0.00970000	218.10740000	0.21400000	-0.06580000	25.73		Best config: FF=0.515 L2=13.4 leaves=16/24
20260428_174853_59f5be1_lightgbm_ps_0001	59f5be1	lightgbm_ps_0001	discard	0.17852500	not_pricing	not_segmentation	0.18350000	-0.01990000	217.05850000	0.21210000	-0.07810000	28.74	pricing_capped_gini_not_materially_worse;segmentation_minimum_capped_gini_gain;segmentation_minimum_fold_agreement	ps: FF=0.480 L2=12.5
20260428_174922_4f934df_lightgbm_ps_0002	4f934df	lightgbm_ps_0002	discard	0.17982500	not_pricing	not_segmentation	0.18510000	-0.02110000	216.97440000	0.21370000	-0.07570000	30.65	pricing_capped_gini_not_materially_worse;segmentation_minimum_capped_gini_gain;segmentation_minimum_fold_agreement	ps: FF=0.482 L2=16.8
20260428_174953_a6dad23_lightgbm_ex_0003	a6dad23	lightgbm_ex_0003	discard	0.18387500	not_pricing	not_segmentation	0.18730000	-0.01370000	217.69100000	0.20760000	-0.07550000	29.90	pricing_material_improvement;pricing_raw_gini_not_materially_worse;segmentation_minimum_capped_gini_gain;segmentation_minimum_fold_agreement;segmentation_raw_gini_not_materially_worse	ex: FF=0.534 L2=14.6
20260428_175024_d0615b0_lightgbm_ps_0004	d0615b0	lightgbm_ps_0004	discard	0.18192500	not_pricing	not_segmentation	0.18550000	-0.01430000	217.69740000	0.21070000	-0.06530000	31.02	pricing_material_improvement;pricing_capped_gini_not_materially_worse;segmentation_minimum_capped_gini_gain;segmentation_minimum_fold_agreement	ps: FF=0.480 L2=17.4
20260428_175055_408edbf_lightgbm_ex_0005	408edbf	lightgbm_ex_0005	discard	0.17980000	not_pricing	not_segmentation	0.18380000	-0.01600000	217.42980000	0.20930000	-0.07010000	27.66	pricing_capped_gini_not_materially_worse;segmentation_minimum_capped_gini_gain;segmentation_minimum_fold_agreement	ex: FF=0.536 L2=12.3
20260428_175123_42fd6b9_lightgbm_ft_0006	42fd6b9	lightgbm_ft_0006	discard	0.18132500	not_pricing	not_segmentation	0.18500000	-0.01470000	217.56220000	0.20820000	-0.07500000	29.19	pricing_capped_gini_not_materially_worse;pricing_raw_gini_not_materially_worse;segmentation_minimum_capped_gini_gain;segmentation_minimum_fold_agreement;segmentation_raw_gini_not_materially_worse	ft: FF=0.522 L2=12.9
20260428_175153_b1a84b1_lightgbm_ex_0007	b1a84b1	lightgbm_ex_0007	discard	0.18562500	not_pricing	not_segmentation	0.18840000	-0.01110000	217.93590000	0.20290000	-0.07650000	29.07	pricing_material_improvement;pricing_raw_gini_not_materially_worse;segmentation_minimum_capped_gini_gain;segmentation_minimum_fold_agreement;segmentation_raw_gini_not_materially_worse	ex: FF=0.539 L2=15.0
20260428_175222_15c6949_lightgbm_ex_0008	15c6949	lightgbm_ex_0008	discard	0.18472500	not_pricing	not_segmentation	0.18810000	-0.01350000	217.75650000	0.21630000	-0.05800000	30.61	pricing_material_improvement;segmentation_minimum_capped_gini_gain;segmentation_minimum_fold_agreement	ex: FF=0.485 L2=12.0
20260428_175253_54338a8_lightgbm_ps_0009	54338a8	lightgbm_ps_0009	discard	0.18577500	not_pricing	not_segmentation	0.18920000	-0.01370000	217.77860000	0.21660000	-0.07410000	29.53	pricing_material_improvement;segmentation_minimum_capped_gini_gain;segmentation_minimum_fold_agreement	ps: FF=0.480 L2=14.6
20260428_175323_66bb045_lightgbm_ft_0010	66bb045	lightgbm_ft_0010	discard	0.18155000	not_pricing	not_segmentation	0.18560000	-0.01620000	217.43420000	0.21060000	-0.07440000	28.14	pricing_capped_gini_not_materially_worse;segmentation_minimum_capped_gini_gain;segmentation_minimum_fold_agreement	ft: FF=0.507 L2=13.2
20260428_175352_4a3f449_lightgbm_ft_0011	4a3f449	lightgbm_ft_0011	discard	0.18470000	not_pricing	not_segmentation	0.18810000	-0.01360000	217.70330000	0.21130000	-0.07280000	29.02	pricing_material_improvement;segmentation_minimum_capped_gini_gain;segmentation_minimum_fold_agreement	ft: FF=0.514 L2=12.9
20260428_175421_379c66f_lightgbm_ex_0012	379c66f	lightgbm_ex_0012	keep	0.18375000	candidate	not_segmentation	0.18870000	-0.01980000	217.09820000	0.21510000	-0.07130000	29.95		ex: FF=0.495 L2=11.1
20260428_175452_c45b868_lightgbm_ft_0013	c45b868	lightgbm_ft_0013	discard	0.17665000	not_pricing	not_segmentation	0.18210000	-0.02180000	216.83040000	0.20860000	-0.07530000	29.79	pricing_material_improvement;pricing_capped_gini_not_materially_worse;pricing_raw_gini_not_materially_worse;segmentation_minimum_capped_gini_gain;segmentation_minimum_fold_agreement;segmentation_raw_gini_not_materially_worse	ft: FF=0.523 L2=13.2
20260428_175522_2a5625a_lightgbm_ft_0014	2a5625a	lightgbm_ft_0014	discard	0.18315000	not_pricing	not_segmentation	0.18820000	-0.02020000	217.01560000	0.21430000	-0.07270000	28.82	pricing_material_improvement;segmentation_minimum_capped_gini_gain;segmentation_minimum_fold_agreement	ft: FF=0.512 L2=12.9
20260428_175551_42cbfda_lightgbm_ft_0015	42cbfda	lightgbm_ft_0015	discard	0.18297500	not_pricing	not_segmentation	0.18770000	-0.01890000	217.14960000	0.21210000	-0.07260000	28.12	pricing_material_improvement;segmentation_minimum_capped_gini_gain;segmentation_minimum_fold_agreement	ft: FF=0.512 L2=13.1
20260428_175620_5cbb753_lightgbm_ex_0016	5cbb753	lightgbm_ex_0016	keep	0.18457500	candidate	not_segmentation	0.18780000	-0.01290000	217.76330000	0.21230000	-0.06920000	29.32		ex: FF=0.535 L2=14.8
20260428_175650_eac1944_lightgbm_ex_0017	eac1944	lightgbm_ex_0017	discard	0.18230000	not_pricing	not_segmentation	0.18640000	-0.01640000	217.45530000	0.21020000	-0.08200000	31.61	pricing_material_improvement;segmentation_minimum_capped_gini_gain;segmentation_minimum_fold_agreement	ex: FF=0.483 L2=11.8
20260428_175722_2227bf1_lightgbm_ft_0018	2227bf1	lightgbm_ft_0018	keep	0.17812500	candidate	not_segmentation	0.18320000	-0.02030000	217.00440000	0.21240000	-0.07270000	28.37		ft: FF=0.514 L2=12.9
20260428_175751_a47c4b3_lightgbm_ft_0019	a47c4b3	lightgbm_ft_0019	keep	0.18137500	candidate	not_segmentation	0.18600000	-0.01850000	217.19180000	0.21280000	-0.07340000	29.33		ft: FF=0.509 L2=13.0
20260428_175820_98705aa_lightgbm_ps_0020	98705aa	lightgbm_ps_0020	discard	0.17997500	not_pricing	not_segmentation	0.18560000	-0.02250000	216.79680000	0.21190000	-0.07120000	31.80	pricing_material_improvement;segmentation_minimum_capped_gini_gain;segmentation_minimum_fold_agreement	ps: FF=0.491 L2=12.8
20260428_180853_575a8ed_lightgbm_ft_0001	575a8ed	lightgbm_ft_0001	keep	0.18145000	not_pricing	candidate	0.18650000	-0.02020000	217.00980000	0.21170000	-0.06950000	28.26		ft: FF=0.510 L2=13.2
20260428_180930_62b07d5_lightgbm_ex_0002	62b07d5	lightgbm_ex_0002	discard	0.18092500	not_pricing	not_segmentation	0.18530000	-0.01750000	217.28920000	0.21250000	-0.07310000	28.81	pricing_material_improvement;pricing_capped_gini_not_materially_worse;segmentation_minimum_capped_gini_gain;segmentation_minimum_fold_agreement	ex: FF=0.508 L2=14.6
20260428_181006_1c42f52_lightgbm_ps_0003	1c42f52	lightgbm_ps_0003	discard	0.18185000	not_pricing	not_segmentation	0.18650000	-0.01860000	217.17330000	0.21350000	-0.06950000	29.71	pricing_material_improvement;segmentation_minimum_capped_gini_gain	ps: FF=0.509 L2=16.4
20260428_181058_e98b427_lightgbm_ft_0004	e98b427	lightgbm_ft_0004	discard	0.17885000	not_pricing	not_segmentation	0.18360000	-0.01900000	217.14850000	0.21090000	-0.07300000	27.07	pricing_material_improvement;pricing_capped_gini_not_materially_worse;segmentation_minimum_capped_gini_gain;segmentation_minimum_fold_agreement	ft: FF=0.511 L2=12.9
20260428_181133_c3cab52_lightgbm_ex_0005	c3cab52	lightgbm_ex_0005	discard	0.18185000	not_pricing	not_segmentation	0.18630000	-0.01780000	217.27690000	0.21030000	-0.07290000	28.49	pricing_material_improvement;segmentation_minimum_capped_gini_gain;segmentation_minimum_fold_agreement	ex: FF=0.507 L2=13.2
20260428_181210_6dd5e9b_lightgbm_ft_0006	6dd5e9b	lightgbm_ft_0006	discard	0.17835000	not_pricing	not_segmentation	0.18320000	-0.01940000	217.10750000	0.20960000	-0.07270000	28.38	pricing_material_improvement;pricing_capped_gini_not_materially_worse;segmentation_minimum_capped_gini_gain;segmentation_minimum_fold_agreement	ft: FF=0.514 L2=13.0
