run_id	commit	candidate_id	status	selection_score	pricing_status	segmentation_status	capped_pp_gini_mean	capped_pp_calibration_gap_mean	capped_pp_mae_mean	raw_pp_gini_mean	raw_pp_calibration_gap_mean	runtime_seconds	gate_failures	description
20260428_181247_14911b2_lightgbm_ft_0007	14911b2	lightgbm_ft_0007	discard	0.17800000	not_pricing	not_segmentation	0.18370000	-0.02280000	216.72720000	0.20670000	-0.06870000	29.54	pricing_material_improvement;pricing_capped_gini_not_materially_worse;segmentation_minimum_capped_gini_gain;segmentation_minimum_fold_agreement;segmentation_raw_gini_not_materially_worse	ft: FF=0.520 L2=12.7
20260428_181325_5243d21_lightgbm_ps_0008	5243d21	lightgbm_ps_0008	discard	0.18485000	not_pricing	not_segmentation	0.18820000	-0.01340000	217.79120000	0.21180000	-0.06550000	30.22	pricing_material_improvement;segmentation_minimum_capped_gini_gain;segmentation_minimum_fold_agreement	ps: FF=0.485 L2=13.1
20260428_181403_62ab431_lightgbm_ft_0009	62ab431	lightgbm_ft_0009	discard	0.18042500	not_pricing	not_segmentation	0.18450000	-0.01630000	217.44260000	0.21100000	-0.07250000	28.32	pricing_material_improvement;pricing_capped_gini_not_materially_worse;segmentation_minimum_capped_gini_gain;segmentation_minimum_fold_agreement	ft: FF=0.508 L2=13.0
20260428_181440_dd2bd57_lightgbm_ft_0010	dd2bd57	lightgbm_ft_0010	discard	0.17947500	not_pricing	not_segmentation	0.18440000	-0.01970000	217.06210000	0.21240000	-0.06940000	28.64	pricing_material_improvement;pricing_capped_gini_not_materially_worse;segmentation_minimum_capped_gini_gain;segmentation_minimum_fold_agreement	ft: FF=0.518 L2=12.7
20260428_181517_01aa30a_lightgbm_ft_0011	01aa30a	lightgbm_ft_0011	discard	0.18442500	not_pricing	not_segmentation	0.18770000	-0.01310000	217.71410000	0.20680000	-0.06840000	29.33	pricing_material_improvement;segmentation_minimum_capped_gini_gain;segmentation_minimum_fold_agreement	ft: FF=0.520 L2=13.3
20260428_181556_0bea866_lightgbm_ft_0012	0bea866	lightgbm_ft_0012	discard	0.18057500	not_pricing	not_segmentation	0.18520000	-0.01850000	217.19120000	0.21090000	-0.06930000	28.08	pricing_material_improvement;pricing_capped_gini_not_materially_worse;segmentation_minimum_capped_gini_gain;segmentation_minimum_fold_agreement	ft: FF=0.518 L2=12.6
20260428_181632_8649008_lightgbm_ft_0013	8649008	lightgbm_ft_0013	discard	0.18177500	not_pricing	not_segmentation	0.18620000	-0.01770000	217.25170000	0.21000000	-0.07230000	29.04	pricing_material_improvement;segmentation_minimum_capped_gini_gain;segmentation_minimum_fold_agreement	ft: FF=0.523 L2=13.3
20260428_182235_02f87c1_lightgbm_ps_0014	02f87c1	lightgbm_ps_0014	discard	0.17927500	not_pricing	not_segmentation	0.18450000	-0.02090000	216.99450000	0.20960000	-0.06830000	29.56	pricing_material_improvement;pricing_capped_gini_not_materially_worse;segmentation_minimum_capped_gini_gain;segmentation_minimum_fold_agreement	ps: FF=0.486 L2=16.4
20260428_182313_c914bad_lightgbm_ft_0015	c914bad	lightgbm_ft_0015	discard	0.18125000	not_pricing	not_segmentation	0.18600000	-0.01900000	217.14240000	0.21350000	-0.07310000	28.70	pricing_material_improvement;segmentation_minimum_capped_gini_gain;segmentation_minimum_fold_agreement	ft: FF=0.508 L2=12.7
20260428_182350_d4bc715_lightgbm_ft_0016	d4bc715	lightgbm_ft_0016	discard	0.18090000	not_pricing	not_segmentation	0.18460000	-0.01480000	217.55160000	0.20820000	-0.07510000	29.01	pricing_material_improvement;pricing_capped_gini_not_materially_worse;segmentation_minimum_capped_gini_gain;segmentation_minimum_fold_agreement	ft: FF=0.523 L2=13.1
20260428_182427_673a21e_lightgbm_ex_0017	673a21e	lightgbm_ex_0017	discard	0.18150000	not_pricing	not_segmentation	0.18660000	-0.02040000	217.03670000	0.21500000	-0.07570000	30.42	pricing_material_improvement;segmentation_minimum_capped_gini_gain;segmentation_minimum_fold_agreement	ex: FF=0.490 L2=10.3
20260428_182505_557909c_lightgbm_ft_0018	557909c	lightgbm_ft_0018	discard	0.18157500	not_pricing	not_segmentation	0.18600000	-0.01770000	217.25260000	0.20830000	-0.07640000	29.28	pricing_material_improvement;segmentation_minimum_capped_gini_gain;segmentation_minimum_fold_agreement	ft: FF=0.523 L2=13.3
20260428_182543_8b1769f_lightgbm_ps_0019	8b1769f	lightgbm_ps_0019	discard	0.17837500	not_pricing	not_segmentation	0.18340000	-0.02010000	217.05170000	0.21360000	-0.07680000	31.21	pricing_material_improvement;pricing_capped_gini_not_materially_worse;segmentation_minimum_capped_gini_gain;segmentation_minimum_fold_agreement	ps: FF=0.480 L2=17.9
20260428_182623_5214c89_lightgbm_ft_0020	5214c89	lightgbm_ft_0020	discard	0.18597500	not_pricing	not_segmentation	0.18870000	-0.01090000	217.94250000	0.20980000	-0.07080000	29.72	pricing_material_improvement;segmentation_minimum_capped_gini_gain;segmentation_minimum_fold_agreement	ft: FF=0.515 L2=12.6
20260428_182702_dc46e3c_lightgbm_ft_0021	dc46e3c	lightgbm_ft_0021	discard	0.18095000	not_pricing	not_segmentation	0.18590000	-0.01980000	217.03200000	0.21070000	-0.07300000	28.51	pricing_material_improvement;segmentation_minimum_capped_gini_gain;segmentation_minimum_fold_agreement	ft: FF=0.516 L2=13.2
20260428_182738_d1a5017_lightgbm_ft_0022	d1a5017	lightgbm_ft_0022	discard	0.18482500	not_pricing	not_segmentation	0.18820000	-0.01350000	217.68230000	0.20750000	-0.07630000	29.23	pricing_material_improvement;segmentation_minimum_capped_gini_gain;segmentation_minimum_fold_agreement	ft: FF=0.518 L2=13.0
20260428_182815_afe2d6d_lightgbm_ft_0023	afe2d6d	lightgbm_ft_0023	discard	0.18225000	not_pricing	not_segmentation	0.18710000	-0.01940000	217.09060000	0.21140000	-0.07370000	29.31	pricing_material_improvement;segmentation_minimum_capped_gini_gain;segmentation_minimum_fold_agreement	ft: FF=0.510 L2=13.3
20260428_182853_4cd091d_lightgbm_ex_0024	4cd091d	lightgbm_ex_0024	discard	0.18117500	not_pricing	not_segmentation	0.18610000	-0.01970000	217.07530000	0.20990000	-0.08590000	29.65	pricing_material_improvement;segmentation_minimum_capped_gini_gain	ex: FF=0.534 L2=10.6
20260428_182931_89dce00_lightgbm_ft_0025	89dce00	lightgbm_ft_0025	discard	0.18052500	not_pricing	not_segmentation	0.18550000	-0.01990000	217.04400000	0.21270000	-0.07280000	28.26	pricing_material_improvement;pricing_capped_gini_not_materially_worse;segmentation_minimum_capped_gini_gain	ft: FF=0.509 L2=12.9
20260428_183007_9120e9b_lightgbm_ft_0026	9120e9b	lightgbm_ft_0026	discard	0.17777500	not_pricing	not_segmentation	0.18340000	-0.02250000	216.76520000	0.21080000	-0.07320000	29.35	pricing_material_improvement;pricing_capped_gini_not_materially_worse;segmentation_minimum_capped_gini_gain;segmentation_minimum_fold_agreement	ft: FF=0.516 L2=13.4
20260428_183044_41c224d_lightgbm_ex_0027	41c224d	lightgbm_ex_0027	discard	0.18252500	not_pricing	not_segmentation	0.18760000	-0.02030000	216.98860000	0.21410000	-0.06990000	29.61	pricing_material_improvement;segmentation_minimum_capped_gini_gain	ex: FF=0.512 L2=11.5
20260428_183121_4608f76_lightgbm_ex_0028	4608f76	lightgbm_ex_0028	discard	0.18332500	not_pricing	not_segmentation	0.18800000	-0.01870000	217.19090000	0.21420000	-0.07370000	30.83	pricing_material_improvement;segmentation_minimum_capped_gini_gain;segmentation_minimum_fold_agreement	ex: FF=0.498 L2=11.3
20260428_183200_98bb27c_lightgbm_ft_0029	98bb27c	lightgbm_ft_0029	discard	0.18350000	not_pricing	not_segmentation	0.18810000	-0.01840000	217.17120000	0.21170000	-0.06940000	29.06	pricing_material_improvement;segmentation_minimum_capped_gini_gain;segmentation_minimum_fold_agreement	ft: FF=0.518 L2=13.1
20260428_183238_f23d9e4_lightgbm_ft_0030	f23d9e4	lightgbm_ft_0030	discard	0.17932500	not_pricing	not_segmentation	0.18480000	-0.02190000	216.82480000	0.21280000	-0.06670000	29.02	pricing_material_improvement;pricing_capped_gini_not_materially_worse;segmentation_minimum_capped_gini_gain;segmentation_minimum_fold_agreement	ft: FF=0.508 L2=13.3
20260428_183315_6d56ee7_lightgbm_ft_0031	6d56ee7	lightgbm_ft_0031	discard	0.17750000	not_pricing	not_segmentation	0.18330000	-0.02320000	216.68100000	0.21010000	-0.07370000	29.22	pricing_material_improvement;pricing_capped_gini_not_materially_worse;segmentation_minimum_capped_gini_gain;segmentation_minimum_fold_agreement	ft: FF=0.517 L2=12.8
20260428_183353_5d47446_lightgbm_ex_0032	5d47446	lightgbm_ex_0032	discard	0.18152500	not_pricing	not_segmentation	0.18570000	-0.01670000	217.42900000	0.21330000	-0.07330000	32.54	pricing_material_improvement;pricing_capped_gini_not_materially_worse;segmentation_minimum_capped_gini_gain;segmentation_minimum_fold_agreement	ex: FF=0.484 L2=16.0
20260428_183434_95b206e_lightgbm_ex_0033	95b206e	lightgbm_ex_0033	discard	0.17845000	not_pricing	not_segmentation	0.18460000	-0.02460000	216.51520000	0.21420000	-0.06690000	29.37	pricing_material_improvement;pricing_capped_gini_not_materially_worse;segmentation_minimum_capped_gini_gain;segmentation_minimum_fold_agreement	ex: FF=0.504 L2=10.4
